<?xml version="1.0" encoding="UTF-8"?>

<listaFacturas xmlns:xs="http://www.w3.org/2001/XMLSchema-instance"
xs:noNamespaceSchemaLocation="listaFacturas.xsd">
    <factura fecha="2056-03-23">
        <emisor cif="">
            <nombre>Carlos</nombre>
            <volumenVentas>20</volumenVentas>
        </emisor>
        <pagador cif="">
            <nombrePag>Juan</nombrePag>
        </pagador>
        <importe>300 rupias</importe>
    </factura>
    <factura>
        <emisor cif="">
            <nombre>Calito</nombre>
            <volumenVentas>50</volumenVentas>
        </emisor>
        <pagador cif="">
            <nombrePag>Manuel</nombrePag>
            <volumenVentasPag>400</volumenVentasPag>
        </pagador>
        <importe>6000 rupias</importe>
    </factura>
</listaFacturas>